{
  "schema_id": "gait.voice.call_event",
  "schema_version": "1.0.0",
  "created_at": "2026-02-15T00:00:00Z",
  "call_id": "call_demo",
  "call_seq": 4,
  "turn_index": 1,
  "event_type": "gate.decision",
  "commitment_class": "quote",
  "intent_digest": "5555555555555555555555555555555555555555555555555555555555555555",
  "policy_digest": "6666666666666666666666666666666666666666666666666666666666666666",
  "attributes": {
    "verdict": "allow"
  }
}
